{"archived_r_identity_contract":[{"ctime_ns":1786632608998770766,"device":2069,"inode":77866321,"mode":420,"mtime_ns":1786631399087982955,"nlink":1,"path":"data/closure_v1/locked_evaluation/input_history.parquet","size":480855},{"ctime_ns":1786632609000770813,"device":2069,"inode":77866327,"mode":420,"mtime_ns":1786631947190541903,"nlink":1,"path":"data/closure_v1/locked_evaluation/input_history.parquet.dvc","size":103},{"ctime_ns":1786632608999770790,"device":2069,"inode":77866322,"mode":420,"mtime_ns":1786631399177762777,"nlink":1,"path":"data/closure_v1/locked_evaluation/intent_origins.parquet","size":171047},{"ctime_ns":1786632609001770836,"device":2069,"inode":77866329,"mode":420,"mtime_ns":1786631948099821769,"nlink":1,"path":"data/closure_v1/locked_evaluation/intent_origins.parquet.dvc","size":104},{"ctime_ns":1786632608999770790,"device":2069,"inode":77866323,"mode":420,"mtime_ns":1786631399266661975,"nlink":1,"path":"data/closure_v1/locked_evaluation/origin_features.parquet","size":238955},{"ctime_ns":1786632609002770859,"device":2069,"inode":77866330,"mode":420,"mtime_ns":1786631949019082029,"nlink":1,"path":"data/closure_v1/locked_evaluation/origin_features.parquet.dvc","size":105},{"ctime_ns":1786632609000770813,"device":2069,"inode":77866324,"mode":420,"mtime_ns":1786631399366389002,"nlink":1,"path":"data/closure_v1/locked_evaluation/sequence_features.parquet","size":436677},{"ctime_ns":1786632609003770882,"device":2069,"inode":77866331,"mode":420,"mtime_ns":1786631950094840074,"nlink":1,"path":"data/closure_v1/locked_evaluation/sequence_features.parquet.dvc","size":107},{"ctime_ns":1786632609004770905,"device":2069,"inode":77072773,"mode":420,"mtime_ns":1786631399566552083,"nlink":1,"path":"reports/closure_v1/01_surface/locked_evaluation_input_manifest.json","size":20049},{"ctime_ns":1786632609003770882,"device":2069,"inode":77072772,"mode":420,"mtime_ns":1786631399477478834,"nlink":1,"path":"reports/closure_v1/01_surface/locked_evaluation_input_summary.json","size":443}],"archived_r_identity_sha256":"7c73775ae17797dc08381a3aab78048387bc2eb4ee0041c74e21cdd72368a54c","authorizations":{"dvc_add_authorized":false,"dvc_push_authorized":false,"e0_m_authorized":false,"e0_u_authorized":false,"evaluation_authorized":false,"git_commit_authorized":false,"git_push_authorized":false,"input_bundle_execution_authorized":false,"outcome_access_authorized":false,"r_adoption_authorized":false,"scientific_rerun_authorized":false,"target_access_authorized":false},"base_authority":{"gate":"E0-MIC","h_commit":"6e01932fa6380ac4ed9614ad1ef2cc412d6fab3e","outcome_paths_opened":false,"p_commit":"707fbe92c7147d281c2a272178289e948a137b1b","p_components":[{"bytes":16796,"git_mode":"100644","git_oid":"9bfa5de2c8f713b22a8e4afa0eeb7fd44ca77f9d","path":"configs/closure_v1/locked_evaluation_input_panel_dvc_identity_patch_lock.json","role":"published_p_mic_component","sha256":"43691df14f1857f418ee79b1dd9d96257dbe22ad6b7b0a3d5e906dc878bee435"},{"bytes":6222,"git_mode":"100644","git_oid":"557f22f0fcc3ec2baedf310692fd5e281e9a0498","path":"configs/closure_v1/locked_evaluation_input_panel_dvc_identity_patch_lock_manifest.json","role":"published_p_mic_component","sha256":"1a09368bbcbf1c93cd08e5c9e4bb0d81e0b58b682846d7ad3ea2a81cf8b14433"}],"p_components_sha256":"eabbc4b9f5f2bef24887bbdd05340c2b07c4a30f4723613c87f033ce9689e16e","status":"published_p_mic_authority_validated"},"coordination_namespace":{"coordination_present_count":0,"formal_e0_m_output_present_count":0,"guard_present":false,"outcome_access_log_absent":true,"outcome_paths_opened":false,"p_output_present_count":0,"predecessor_coordination_present_count":0,"r_output_present_count":0,"r_state":"absent","temporary_present_count":0},"experiment_id":"closure_v1","failed_attempt":{"attempted_gate":"R-E0-MI","dvc_add_completed":true,"dvc_push_performed":false,"failure_code":"sealed_input_manifest_dialect_rejected_by_generic_dialect","generic_failure_count":3,"git_commit_performed":false,"git_push_performed":false,"phase":"precommit_generic_manifest_validation","precommit_exit_code":1,"r_bytes_changed":false,"r_output_count":10,"r_rewrite_performed":false,"report_sha256":"d843c34f2260f8f5a7a0745492099265a44a85c9240956589a8caf9b219d8aef","retry_authorized":false,"scientific_rerun_performed":false,"status":"failed_closed_exact_r_preserved"},"gate":"E0-MID","generated_at_utc":"2026-08-13T15:37:47.104442+00:00","generic_manifest_findings_contract":[{"check":"manifest","level":"fail","message":"Experiment manifest status is `completed_unpublished`, expected `completed`.","path":"reports/closure_v1/01_surface/locked_evaluation_input_manifest.json"},{"check":"manifest","level":"fail","message":"Experiment manifest must contain a non-empty `outputs` list.","path":"reports/closure_v1/01_surface/locked_evaluation_input_manifest.json"},{"check":"manifest","level":"fail","message":"Staged report artifact is not listed in any experiment manifest output.","path":"reports/closure_v1/01_surface/locked_evaluation_input_summary.json"}],"h_patch":{"added_count":5,"component_count":6,"components":[{"bytes":19478,"git_mode":"100644","git_oid":"33a9f24cd4d48e067659aa42f8f615299dc50a6f","path":"configs/closure_v1/locked_evaluation_input_manifest_dialect_patch_lock.schema.json","role":"locked_evaluation_input_manifest_dialect_patch_h_component","sha256":"e8122b418e1bd5e38db5099e09b32bbf20087f54e243871ba292bd52b43a55fa"},{"bytes":15382,"git_mode":"100644","git_oid":"fa07cef368d4363be8b3f3c6f924622aa5026598","path":"docs/closure_v1/E0_M_LOCKED_EVALUATION_INPUT_MANIFEST_DIALECT_PATCH.md","role":"locked_evaluation_input_manifest_dialect_patch_h_component","sha256":"eb099230941aa12e07ad060f7b81ae69f1541eff0e41275e42f2158cf33f46ad"},{"bytes":496259,"git_mode":"100755","git_oid":"6e8f381ff555c4b557a8450ade9c92575548859a","path":"src/data/prepare_commit_artifacts.py","role":"locked_evaluation_input_manifest_dialect_patch_h_component","sha256":"9c69a268d6907c142b4fbc6ce3dfc3c56bf9a0fca8f4e3f71ffa0725ad62c30c"},{"bytes":72353,"git_mode":"100644","git_oid":"9338e0ec229319dc09c07e04e594354460b2c882","path":"src/experiments/closure_locked_evaluation_input_manifest_dialect_patch.py","role":"locked_evaluation_input_manifest_dialect_patch_h_component","sha256":"3dfba13d27dc44cf2937ec04af673d42feaa79adf628b6934e5c8c37b39c7c63"},{"bytes":12795,"git_mode":"100644","git_oid":"166c60908f38ff9999e3f28d9bf8a6777e5fa2ae","path":"src/experiments/lock_closure_locked_evaluation_input_manifest_dialect_patch.py","role":"locked_evaluation_input_manifest_dialect_patch_h_component","sha256":"5cc6762f4d2a4104667ca063694af09b8f32e2957b4c41d269289204e4adea5b"},{"bytes":25043,"git_mode":"100644","git_oid":"2e21a0b57824c23b90f0a7549585b9a5235f23a6","path":"tests/test_closure_locked_evaluation_input_manifest_dialect_patch.py","role":"locked_evaluation_input_manifest_dialect_patch_h_component","sha256":"de8c4881f0cfa529648503425779c24f4033c78df792d5ecd50d75d48cc21475"}],"components_sha256":"c62b83e3b02684510d17ede8da870a04e3c43a4439a146dfac85d8e1f394f0a5","gate":"H-E0-MID","modified_count":1},"historical_inputs":[{"bytes":26344,"commit":"6e01932fa6380ac4ed9614ad1ef2cc412d6fab3e","git_mode":"100644","git_oid":"d7798ea230a0e3ea83a2e505fcdb45fd45c60d1c","path":"configs/closure_v1/locked_evaluation_input_panel_dvc_identity_patch_lock.schema.json","role":"superseded_h_mic_component","sha256":"558928822eb33832bddc1b50314193d51fd3fabf7bc3de5abfde2a261c7ad701"},{"bytes":9836,"commit":"6e01932fa6380ac4ed9614ad1ef2cc412d6fab3e","git_mode":"100644","git_oid":"69c298139ae514d870d2dd97a537f804d0d62726","path":"docs/closure_v1/E0_M_LOCKED_EVALUATION_INPUT_PANEL_DVC_IDENTITY_PATCH.md","role":"superseded_h_mic_component","sha256":"bbd01c0392da99b0ee1c861612185dfb899c9b559f67859d3b791eacca288449"},{"bytes":458165,"commit":"6e01932fa6380ac4ed9614ad1ef2cc412d6fab3e","git_mode":"100755","git_oid":"4c3775db5b8d03029d0a401e9ba40923ca3d323d","path":"src/data/prepare_commit_artifacts.py","role":"superseded_h_mic_component","sha256":"35723ccd03cea022dae7ec8577de62b903bb71023e6d2efd42afcdd10019fcaf"},{"bytes":84545,"commit":"6e01932fa6380ac4ed9614ad1ef2cc412d6fab3e","git_mode":"100644","git_oid":"ffcba9422c2733c84a1150a654a0968b12821274","path":"src/experiments/closure_locked_evaluation_input_panel_dvc_identity_patch.py","role":"superseded_h_mic_component","sha256":"c13460940913ff6a1080a88ecee32e5ca7ce682fd61873d17a85f0e6f90219b2"},{"bytes":12914,"commit":"6e01932fa6380ac4ed9614ad1ef2cc412d6fab3e","git_mode":"100644","git_oid":"8166805a3d6472acad495de3906525c85bf7c083","path":"src/experiments/lock_closure_locked_evaluation_input_panel_dvc_identity_patch.py","role":"superseded_h_mic_component","sha256":"d52173870301fedda036bb5c8f02203519f5217dc61ebd48ab79d7d45469461c"},{"bytes":24393,"commit":"6e01932fa6380ac4ed9614ad1ef2cc412d6fab3e","git_mode":"100644","git_oid":"c6bc5ecebe305326521a885b923b50214cbc52be","path":"tests/test_closure_locked_evaluation_input_panel_dvc_identity_patch.py","role":"superseded_h_mic_component","sha256":"bc07051d37e00391aa900becfbc84c6c1490f93466d034e3edc9aa18bde6773e"}],"historical_inputs_sha256":"cf22c92ac6caae3103efcf674fa154ee25f7a0d8d99c8e3b6dae4b9417887f50","manifest_dialect_contract":{"adoption_policy":"exact_multiset_after_strict_input_only_validation_only","generic_expected_status":"completed","generic_non_ok_finding_count":3,"generic_output_field":"outputs","manifest_status":"completed_unpublished","r_rewrite_authorized":false,"scientific_rerun_authorized":false,"strict_physical_output_field":"physical_outputs","strict_summary_field":"summary"},"prelock":{"archive_bytes_opened":false,"archive_identity_sha256":"7c73775ae17797dc08381a3aab78048387bc2eb4ee0041c74e21cdd72368a54c","archive_identity_verified":true,"archive_metadata_inspected":true,"archive_parent_walk_no_follow":true,"archived_r_count":10,"archived_r_preserved":true,"base_p_mic_output_present_count":2,"companion_contract":{"historical_input_count":6,"manifest_written_last":tr